{
  "id": "southbank-01",
  "name": "Southbank \u2014 Demo Hall",
  "map": "/assets/venue/map.png",
  "pins": [
    {
      "label": "Entrance",
      "x": 0.12,
      "y": 0.85
    },
    {
      "label": "Bar",
      "x": 0.65,
      "y": 0.4
    },
    {
      "label": "Merch",
      "x": 0.8,
      "y": 0.2
    }
  ],
  "faqs": [
    {
      "q": "Is flash used?",
      "a": "Yes, occasional strobe in Act II."
    },
    {
      "q": "Accessibility seating?",
      "a": "Front-left block reserved; ask staff."
    }
  ]
}